{
  "schemaVersion": "1.0",
  "generatedAt": "2026-06-19T14:30:00Z",
  "projectName": "acme-commerce",
  "outputFolder": "bmad-output",
  "stories": [
    {
      "id": "1.1.project-setup",
      "storyFilePath": "bmad-output/stories/1.1.project-setup.story.md",
      "status": "ready-for-dev",
      "epic": "1",
      "storyNumber": "1",
      "title": "Project Scaffolding and CI Pipeline",
      "ownedScope": [
        "package.json",
        "tsconfig.json",
        ".github/workflows/ci.yml",
        "src/"
      ],
      "wave": 1,
      "parallelSet": null,
      "dependencies": [],
      "acceptanceCriteriaSummary": [
        "Given a clean checkout, when `npm install && npm run build` runs, then it exits 0 with no errors",
        "Given a push to any branch, when the CI workflow triggers, then lint and type-check steps pass",
        "Given a new developer, when they follow the README quickstart, then local dev server starts within 5 min"
      ],
      "lockedSectionsNote": "Sections Acceptance Criteria, Dev Notes, and Testing are LOCKED. External dev tools must not edit them. Populate only the Dev Agent Record section.",
      "devAgentRecord": null
    },
    {
      "id": "1.2.user-model",
      "storyFilePath": "bmad-output/stories/1.2.user-model.story.md",
      "status": "ready-for-dev",
      "epic": "1",
      "storyNumber": "2",
      "title": "User Data Model and Database Migration",
      "ownedScope": [
        "src/db/migrations/001_create_users.sql",
        "src/models/user.ts",
        "src/models/__tests__/user.test.ts"
      ],
      "wave": 2,
      "parallelSet": null,
      "dependencies": [
        "1.1.project-setup"
      ],
      "acceptanceCriteriaSummary": [
        "Given a fresh database, when migration runs, then the users table is created with all required columns",
        "Given a valid payload, when User.create() is called, then a row is inserted and the id is returned",
        "Given a duplicate email, when User.create() is called, then a UniqueConstraintError is thrown"
      ],
      "lockedSectionsNote": "Sections Acceptance Criteria, Dev Notes, and Testing are LOCKED. External dev tools must not edit them. Populate only the Dev Agent Record section.",
      "devAgentRecord": null
    },
    {
      "id": "1.3.user-auth",
      "storyFilePath": "bmad-output/stories/1.3.user-auth.story.md",
      "status": "ready-for-dev",
      "epic": "1",
      "storyNumber": "3",
      "title": "User Authentication — Register, Login, JWT",
      "ownedScope": [
        "src/api/routes/auth.ts",
        "src/services/auth-service.ts",
        "src/middleware/require-auth.ts",
        "src/services/__tests__/auth-service.test.ts"
      ],
      "wave": 3,
      "parallelSet": null,
      "dependencies": [
        "1.2.user-model"
      ],
      "acceptanceCriteriaSummary": [
        "Given valid credentials, when POST /auth/login is called, then a signed JWT is returned with 1-hour expiry",
        "Given an expired JWT, when a protected route is called, then a 401 with message 'Token expired' is returned",
        "Given a new email and password, when POST /auth/register is called, then user is created and JWT returned"
      ],
      "lockedSectionsNote": "Sections Acceptance Criteria, Dev Notes, and Testing are LOCKED. External dev tools must not edit them. Populate only the Dev Agent Record section.",
      "devAgentRecord": null
    },
    {
      "id": "2.1.stripe-integration",
      "storyFilePath": "bmad-output/stories/2.1.stripe-integration.story.md",
      "status": "ready-for-dev",
      "epic": "2",
      "storyNumber": "1",
      "title": "Stripe Payment Integration — Checkout Flow",
      "ownedScope": [
        "src/payments/stripe-client.ts",
        "src/payments/checkout-service.ts",
        "src/api/routes/checkout.ts",
        "tests/payments/"
      ],
      "wave": 3,
      "parallelSet": "wave-3-parallel",
      "dependencies": [
        "1.2.user-model"
      ],
      "acceptanceCriteriaSummary": [
        "Given a valid cart, when the user clicks Pay, then a Stripe checkout session is created within 2 s",
        "Given a failed payment, when the Stripe webhook fires, then order status is set to payment-failed",
        "Given a successful payment, when webhook fires, then order is confirmed and confirmation email is sent"
      ],
      "lockedSectionsNote": "Sections Acceptance Criteria, Dev Notes, and Testing are LOCKED. External dev tools must not edit them. Populate only the Dev Agent Record section.",
      "devAgentRecord": null
    }
  ]
}
